### ISSUE TITLE
iperf 3.21: UDP server with multiple IP aliases may send replies from unexpected addresses

### ISSUE THREAD

**Issue by garrymar** [esnet/iperf#2059]
Hi iperf3 Team,

It was noticed that when a UDP server has multiple IP aliases bound to the same interface, replies to the client may be sent from an unexpected alias, causing the client to refuse them.

For example, this can be replicated locally with the following method:

```
# Create a new network instance
sudo ip net add iperf3

# Create a veth pair
sudo ip link add type veth

# Assign one veth to the new namespace
sudo ip link set veth1 netns iperf3

# Assign primary and secondary IPs to the server side
sudo ip net exec iperf3 ip addr add 172.16.0.101/24 dev veth1
sudo ip net exec iperf3 ip addr add 172.16.0.102/32 dev veth1
sudo ip net exec iperf3 ip link set lo up
sudo ip net exec iperf3 ip link set veth1 up

# Setup local/client side
sudo ip addr add 172.16.0.1/24 dev veth0
sudo ip link set veth0 up

# Start the server
sudo ip net exec iperf3 iperf3 -sD

# Start the UDP test
iperf3 -c 172.16.0.102 -u
```

Once executed, the client fails after a timeout:

```
iperf3 -c 172.16.0.102 -u
Connecting to host 172.16.0.102, port 5201
iperf3: error - unable to read from stream socket: Resource temporarily unavailable
```

The packet analysis shows that the server replies from the primary IP instead of the secondary one that was requested by the client:

```
$ sudo tcpdump -ni veth0
tcpdump: verbose output suppressed, use -v[v]... for full protocol decode
listening on veth0, link-type EN10MB (Ethernet), snapshot length 262144 bytes
00:48:23.057082 IP 172.16.0.1.45366 > 172.16.0.102.5201: Flags [S], seq 4141894149, win 64240, options [mss 1460,sackOK,TS val 3389603211 ecr 0,nop,wscale 10], length 0
00:48:23.057136 IP 172.16.0.102.5201 > 172.16.0.1.45366: Flags [S.], seq 1522049059, ack 4141894150, win 65160, options [mss 1460,sackOK,TS val 947939836 ecr 3389603211,nop,wscale 10], length 0
00:48:23.057161 IP 172.16.0.1.45366 > 172.16.0.102.5201: Flags [.], ack 1, win 63, options [nop,nop,TS val 3389603211 ecr 947939836], length 0
00:48:23.057215 IP 172.16.0.1.45366 > 172.16.0.102.5201: Flags [P.], seq 1:38, ack 1, win 63, options [nop,nop,TS val 3389603211 ecr 947939836], length 37
00:48:23.057229 IP 172.16.0.102.5201 > 172.16.0.1.45366: Flags [.], ack 38, win 64, options [nop,nop,TS val 947939836 ecr 3389603211], length 0
00:48:23.057367 IP 172.16.0.102.5201 > 172.16.0.1.45366: Flags [P.], seq 1:2, ack 38, win 64, options [nop,nop,TS val 947939836 ecr 3389603211], length 1
00:48:23.057391 IP 172.16.0.1.45366 > 172.16.0.102.5201: Flags [.], ack 2, win 63, options [nop,nop,TS val 3389603211 ecr 947939836], length 0
00:48:23.057503 IP 172.16.0.1.45366 > 172.16.0.102.5201: Flags [P.], seq 38:42, ack 2, win 63, options [nop,nop,TS val 3389603211 ecr 947939836], length 4
00:48:23.057537 IP 172.16.0.1.45366 > 172.16.0.102.5201: Flags [P.], seq 42:256, ack 2, win 63, options [nop,nop,TS val 3389603211 ecr 947939836], length 214
00:48:23.057623 IP 172.16.0.102.5201 > 172.16.0.1.45366: Flags [.], ack 256, win 64, options [nop,nop,TS val 947939836 ecr 3389603211], length 0
00:48:23.057844 IP 172.16.0.102.5201 > 172.16.0.1.45366: Flags [P.], seq 2:3, ack 256, win 64, options [nop,nop,TS val 947939837 ecr 3389603211], length 1

vvvvvvvvvvvvvvvvvvvv
00:48:23.057997 IP 172.16.0.1.58529 > 172.16.0.102.5201: UDP, length 4
00:48:23.058222 IP 172.16.0.101.5201 > 172.16.0.1.58529: UDP, length 4
00:48:23.058266 IP 172.16.0.1 > 172.16.0.101: ICMP 172.16.0.1 udp port 58529 unreachable, length 40
^^^^^^^^^^^^^^^^^^^^^

00:48:23.058571 IP 172.16.0.102.5201 > 172.16.0.1.45366: Flags [P.], seq 3:4, ack 256, win 64, options [nop,nop,TS val 947939837 ecr 3389603211], length 1
00:48:23.058625 IP 172.16.0.102.5201 > 172.16.0.1.45366: Flags [P.], seq 4:5, ack 256, win 64, options [nop,nop,TS val 947939837 ecr 3389603211], length 1
00:48:23.061890 IP 172.16.0.102.5201 > 172.16.0.1.45366: Flags [P.], seq 4:5, ack 256, win 64, options [nop,nop,TS val 947939841 ecr 3389603211], length 1
00:48:23.061905 IP 172.16.0.1.45366 > 172.16.0.102.5201: Flags [.], ack 5, win 63, options [nop,nop,TS val 3389603216 ecr 947939837,nop,nop,sack 1 {4:5}], length 0
```

TCP tests are not affected.

As far as I understand, it is the default Linux kernel behaviour for UDP sockets. However, I wonder if iperf3 can be involved more in the process and instruct the kernel to use the IP address that was requested by the client.

Thank you.

Regards,
Garri

**Comment by garrymar** [comment]
Version info:
```
$ iperf3 -v
iperf 3.21 (cJSON 1.7.15)
Linux archlinux 7.0.11-arch1-1 #1 SMP PREEMPT_DYNAMIC Tue, 02 Jun 2026 18:26:58 +0000 x86_64
Optional features available: CPU affinity setting, IPv6 flow label, SCTP, TCP congestion algorithm setting, sendfile / zerocopy, socket pacing, authentication, bind to device, support IPv4 don't fragment, POSIX threads, GSO/GRO support
```
