### ISSUE TITLE
-u is ignored

### ISSUE THREAD

**Issue by WhiteFossa** [esnet/iperf#777]
# Context

* Version of iperf3: iperf 3.5 (cJSON 1.5.2)

* Operating system (and distribution, if any): Fedora 28

# Bug Report

* Expected Behavior
Providing -u key to iperf3 (e.g. iperf3 -u -c whitefossa.org -p 4444) causes iperf3 to use UDP.

* Actual Behavior
Initial handshake still use TCP and if TCP blocked so iperf3 is unable to connect.

Here is my logs from tcpdump (tcpdump -i bond0 tcp port 4444 -nn, called on fedora client machine):

[root@fossa-main fossa]# tcpdump -i bond0 tcp port 4444 -nn
tcpdump: verbose output suppressed, use -v or -vv for full protocol decode
listening on bond0, link-type EN10MB (Ethernet), capture size 262144 bytes
00:16:54.592946 IP 10.254.0.3.55640 > 84.22.105.204.4444: Flags [S], seq 3540440364, win 26880, options [mss 8960,sackOK,TS val 3013180746 ecr 0,nop,wscale 8], length 0
00:16:55.650189 IP 10.254.0.3.55640 > 84.22.105.204.4444: Flags [S], seq 3540440364, win 26880, options [mss 8960,sackOK,TS val 3013181803 ecr 0,nop,wscale 8], length 0
00:16:57.698250 IP 10.254.0.3.55640 > 84.22.105.204.4444: Flags [S], seq 3540440364, win 26880, options [mss 8960,sackOK,TS val 3013183851 ecr 0,nop,wscale 8], length 0
00:17:01.730233 IP 10.254.0.3.55640 > 84.22.105.204.4444: Flags [S], seq 3540440364, win 26880, options [mss 8960,sackOK,TS val 3013187883 ecr 0,nop,wscale 8], length 0

* Steps to Reproduce

Call iperf3 client with -u flag and monitor network activity for TCP.

* Possible Solution

**Comment by bmah888** [comment]
The iperf3 client and server processes use a control channel, which runs over a TCP connection, to exchange test parameters and coordinate the start and end of test.  You will always see some TCP traffic before and after the actual test transfer.  What you're seeing is totally normal, and yes you need to be sure this TCP traffic is allowed between the two endpoints.

**Comment by WhiteFossa** [comment]
Thanks for explaination.
