### ISSUE TITLE
The server does not return acknowledgement packet

### ISSUE THREAD

**Issue by Yukinarii** [esnet/iperf#752]
# Context
Version of iperf3: iperf-3.2

Hardware: VM

Operating system (and distribution, if any): Ubuntu 16.04LTS

Other relevant information (for example, non-default compilers,
libraries, cross-compiling, etc.): None

# Bug Report
I try building a connection with a virtual IP such as 192.168.1.2 and send it to the switch with command

`iperf -c 192.168.1.2 -t 5`
The program inside the switch(a load balancer) will modify the destination IP address to a real IP address such as 10.0.14.10.

However, when I monitor the connection by tcpdump, I can only see the messages about the packet from sender(10.0.11.10) to the receiver(10.0.14.10) while there are no acknowledgement packets sent back.

`02:31:49.090283 IP 10.0.11.10.44804 > 10.0.14.10.5001: Flags [S], seq 1080664336
02:31:49.090287 IP 10.0.11.10.44818 > 10.0.14.10.5001: Flags [S], seq 77079851,
02:31:49.090290 IP 10.0.11.10.44814 > 10.0.14.10.5001: Flags [S], seq 2195630779
02:31:49.090292 IP 10.0.11.10.44810 > 10.0.14.10.5001: Flags [S], seq 2432346974
02:31:49.090294 IP 10.0.11.10.44820 > 10.0.14.10.5001: Flags [S], seq 943429403,
02:31:49.090308 IP 10.0.11.10.44806 > 10.0.14.10.5001: Flags [S], seq 1627715030`

It seems that the iperf server receives packets correctly, but the connection isn't built due to the client does not send back acknowledgement packet.
