### ISSUE TITLE
Why did the server take the initiative to disconnect from the client

### ISSUE THREAD

**Issue by sheva7777** [esnet/iperf#1135]
_NOTE: The iperf3 issue tracker is for registering bugs, enhancement
requests, or submissions of code.  It is not a means for asking
questions about building or using iperf3.  Those are best directed
towards the iperf3 mailing list at iperf-dev@googlegroups.com or
question sites such as Stack Overflow
(http://www.stackoverflow.com/).  A list of frequently-asked questions
regarding iperf3 can be found at http://software.es.net/iperf/faq.html._

# Context

* Version of iperf3:
iperf 3.9+ (cJSON 1.7.13)
* Hardware:
x86_64
* Operating system (and distribution, if any):
Centos 7.5
_Please note: iperf3 is supported on Linux, FreeBSD, and macOS.
Support may be provided on a best-effort basis to other UNIX-like
platforms.  We cannot provide support for building and/or running
iperf3 on Windows, iOS, or Android._

* Other relevant information (for example, non-default compilers,
  libraries, cross-compiling, etc.):

_Please fill out one of the "Bug Report" or "Enhancement Request"
sections, as appropriate._

# Bug Report
At first,the client1 and the server of iperf3 worked normally.But after receiving a RST packet from client2 on the port monitored by the server,the server sent a FIN packet to client1 immediately.Then The connection of client1 with server was interrupted

* Expected Behavior
A RST packet from client2 will not influence the connection of client1 with server
* Actual Behavior
A RST packet from client2 influence the connection of client1
client1:10.10.0.3
server:10.10.0.7
client2:10.10.0.4

```
    10.10.0.4.42830 > 10.10.0.7.3333: Flags [R.], cksum 0x1950 (correct), seq 1, ack 1, win 229, options [nop,nop,TS val 0 ecr 33553235], length 0
18:57:15.226954 IP (tos 0x0, ttl 64, id 37356, offset 0, flags [DF], proto TCP (6), length 52)
    10.10.0.7.3333 > 10.10.0.3.60746: Flags [F.], cksum 0x1444 (incorrect -> 0x1c3d), seq 1, ack 86918, win 1432, options [nop,nop,TS val 33553236 ecr 33566042], length 0
18:57:15.226998 IP (tos 0x0, ttl 64, id 54678, offset 0, flags [DF], proto TCP (6), length 52)
    10.10.0.7.3333 > 10.10.0.3.60744: Flags [F.], cksum 0x1444 (incorrect -> 0xf3ab), seq 5, ack 163, win 227, options [nop,nop,TS val 33553236 ecr 33566041], length 0
18:57:15.227547 IP (tos 0x0, ttl 64, id 56322, offset 0, flags [DF], proto TCP (6), length 53)
    10.10.0.3.60744 > 10.10.0.7.3333: Flags [P.], cksum 0xe1ca (correct), seq 163:164, ack 6, win 229, options [nop,nop,TS val 33566511 ecr 33553236], length 1
18:57:15.227561 IP (tos 0x0, ttl 64, id 34402, offset 0, flags [DF], proto TCP (6), length 40)
    10.10.0.7.3333 > 10.10.0.3.60744: Flags [R], cksum 0xf51e (correct), seq 2137402608, win 0, length 0
18:57:15.227851 IP (tos 0x0, ttl 64, id 9426, offset 0, flags [DF], proto TCP (6), length 52)
```

* Steps to Reproduce

server:
iperf3 -s -p 3333

client1:
iperf3 -c 10.10.0.7 -i 1 -p 3333 -b 1M
* Possible Solution

**Comment by davidBar-On** [comment]
Can you please include more information, as the scenario is not completely clear:
- Run the server with `--timestamp --verbose --debug` options, and show the relevant part of this log.
- Include also the messages to/from client2 messages before cleint2 sent the RST.
- What was the command used to run the client2?
- Before receiving the FIN from the server, client1 sent 86918 bytes, about 700Kbits, which is less then a second with the 1 Mbps throughput.  If client1 worked o.k. it means client1 and client2 started almost together.  Is this the case?

**Comment by sheva7777** [comment]
sorry，I did not say it clearly.
client2 performed a health check on client1.Every time after client2 establishs a TCP connection with client1,client2 would send a RST to client1.
I guess, after the RST from client2,the connection between client1 and server is unnormal.Because if I stop client2,everthing is ok

server:

Fri Apr  9 11:00:37 2021 iperf3: error - unable to receive cookie at server: Connection reset by peer
Fri Apr  9 11:00:37 2021 iperf 3.9+
Fri Apr  9 11:00:37 2021 Fri Apr  9 11:00:37 2021 Linux 3.10.0-862.el7.x86_64 #1 SMP Fri Apr 20 16:44:24 UTC 2018 x86_64
Fri Apr  9 11:00:37 2021 -----------------------------------------------------------
Fri Apr  9 11:00:37 2021 Server listening on 3333 (test #18)
Fri Apr  9 11:00:37 2021 -----------------------------------------------------------
get_parameters:
{
        "tcp":  true,
        "omit": 0,
        "time": 60,
        "parallel":     1,
        "len":  131072,
        "bandwidth":    1000000,
        "pacing_timer": 1000,
        "client_version":       "3.9+"
}
SNDBUF is 16384, expecting 0
RCVBUF is 87380, expecting 0
Fri Apr  9 11:00:39 2021 Time: Fri, 09 Apr 2021 03:00:39 GMT
Fri Apr  9 11:00:39 2021 Accepted connection from 10.10.0.3, port 42622
Fri Apr  9 11:00:39 2021       Cookie:
Fri Apr  9 11:00:39 2021       TCP MSS: 0 (default)
Fri Apr  9 11:00:39 2021       Target Bitrate: 1000000
Congestion algorithm is cubic
Fri Apr  9 11:00:39 2021 [  5] local 10.10.0.7 port 3333 connected to 10.10.0.3 port 42624
Fri Apr  9 11:00:39 2021 Starting Test: protocol: TCP, 1 streams, 131072 byte blocks, omitting 0 seconds, 60 second test, tos 0
tcpi_snd_cwnd 10 tcpi_snd_mss 1448 tcpi_rtt 0
interval_len 1.000450 bytes_transferred 131072
interval forces keep
Fri Apr  9 11:00:40 2021 [ ID] Interval           Transfer     Bitrate
Fri Apr  9 11:00:40 2021 [  5]   0.00-1.00   sec   128 KBytes  1.05 Mbits/sec
tcpi_snd_cwnd 10 tcpi_snd_mss 1448 tcpi_rtt 0
interval_len 1.000578 bytes_transferred 131072
interval forces keep
Fri Apr  9 11:00:41 2021 [  5]   1.00-2.00   sec   128 KBytes  1.05 Mbits/sec
Fri Apr  9 11:00:42 2021 iperf3: error - unable to send control message: Connection reset by peer
Fri Apr  9 11:00:42 2021 iperf 3.9+
Fri Apr  9 11:00:42 2021 Fri Apr  9 11:00:42 2021 Linux 3.10.0-862.el7.x86_64 #1 SMP Fri Apr 20 16:44:24 UTC 2018 x86_64
Fri Apr  9 11:00:42 2021 -----------------------------------------------------------


client1:
Connecting to host 10.10.0.7, port 3333
[  5] local 10.10.0.3 port 42624 connected to 10.10.0.7 port 3333
[ ID] Interval           Transfer     Bitrate         Retr  Cwnd
[  5]   0.00-1.00   sec   128 KBytes  1.05 Mbits/sec    0   56.6 KBytes
[  5]   1.00-2.00   sec   128 KBytes  1.05 Mbits/sec    0   59.4 KBytes
[  5]   1.00-2.00   sec   128 KBytes  1.05 Mbits/sec    0   59.4 KBytes
iperf3: error - control socket has closed unexpectedly

**Comment by davidBar-On** [comment]
> Every time after client2 establishes a TCP connection with server,client2 would send a RST to server.

I believe I understand what is the problem (a bug in the server), but just to confirm  - client2 send the RST **immediately** after connecting to the server.  **Is this correct?**

If my assumption is correct, then if client2 will wait a while (probably few 100ms) between connecting to the server and sending the RST, this should solve the problem. However, if client1 will try to connect to the server during this time it will fail.  In any case, to verify my assumption and if this is easy to do, **can you add a 1 sec wait in the client2 to make sure it solves the problem?**

**Comment by sheva7777** [comment]
>  client2 send the RST immediately after connecting to the server. Is this correct?

Yes,very immediately after the three handshakes.
![image](https://user-images.githubusercontent.com/39009843/114153781-45a8f200-9952-11eb-8741-882ac2d01e9b.png)

**Comment by davidBar-On** [comment]
> Yes,very immediately after the three handshakes.

This Wireshark log see to confirm the issue.  Currently, when iperf3 server receives a connection request while running a test it send a rejection response to the new client.  The problem is that if sending this rejection fails, the server stops the running test.  Since client2 disconnected immediately, the server failed to send the response and stopped client1 test.

Later I will submit a PR with a fix for this issue.  Meanwhile, I happen to working on an iperf3 enhancement that also fix this issue.  If you know how to build iperf3 you can try using a server from my private branch.  It is not fully tested yet, but I believe that for your tests it should work fine (until I will submit the PR with the suggested fix).  The private branch is: [https://github.com/davidBar-On/iperf/tree/new-connection-accept-first-with-valid-cookie](https://github.com/davidBar-On/iperf/tree/new-connection-accept-first-with-valid-cookie)

**Comment by davidBar-On** [comment]
Submitted PR #1138 that should fix the issue.
